{
  "slug": "2026-09-30-eindverbruikersprijzen-eerste-halfjaar",
  "titel": "Eindverbruikersprijzen gas en elektriciteit aangevuld met de eerste helft van 2026",
  "samenvatting": "CBS voegde op 30 september de cijfers over het eerste halfjaar van 2026 toe aan de tabel Eindverbruikersprijzen aardgas en elektriciteit. De reeks loopt per halfjaar vanaf 2009; de twee recentste halfjaren zijn voorlopig. Nieuwe cijfers verschijnen drie maanden na afloop van een halfjaar, dus eind maart en eind september.",
  "thema": "markt",
  "bron": "CBS StatLine",
  "bronUrl": "https://www.cbs.nl/nl-nl/cijfers/detail/85666NED",
  "gepubliceerd": "2026-09-30",
  "toegevoegd": "2026-10-22T23:05:00+02:00",
  "zekerheid": "hoog"
}
