{
  "slug": "2026-10-07-startanalyse-aardgasvrije-buurten-geactualiseerd",
  "titel": "PBL rekent de Startanalyse aardgasvrije buurten opnieuw door",
  "samenvatting": "Het PBL publiceerde op 7 oktober de geactualiseerde Startanalyse: kosten van warmtealternatieven voor 14.000 buurten en 3.500 wijken, per buurt te bekijken op startanalyse.pbl.nl. Belangrijkste wijziging is dat voor 2050 niet langer 2 miljard kuub klimaatneutraal gas wordt aangenomen. Daardoor stijgt het aandeel volledig elektrische warmtepompen in het eindbeeld van ongeveer een derde naar twee derde.",
  "thema": "verbruik",
  "bron": "PBL",
  "bronUrl": "https://www.pbl.nl/publicaties/actualisatie-startanalyse-aardgasvrije-buurten-2026",
  "gepubliceerd": "2026-10-07",
  "toegevoegd": "2026-10-22T23:05:00+02:00",
  "zekerheid": "hoog"
}
