{
  "slug": "2026-10-08-capaciteitskaart-noorden",
  "titel": "Nieuwe versie capaciteitskaart toont meer ruimte voor teruglevering in het noorden",
  "samenvatting": "Voorbeeld. Korte samenvatting in eigen woorden: wat is er veranderd en wat betekent het voor wie met de data werkt.",
  "thema": "net",
  "bron": "Voorbeeldbron",
  "bronUrl": "https://example.org/capaciteitskaart",
  "gepubliceerd": "2026-10-08",
  "toegevoegd": "2026-10-09T07:00:00+02:00",
  "datasets": [],
  "zekerheid": "hoog",
  "voorbeeld": true
}