{
  "slug": "2026-10-05-stand-van-de-uitvoering-eerste-helft-2026",
  "titel": "Wachtrij voor afname groeit, wachtrij voor invoeding daalt voor het eerst",
  "samenvatting": "Netbeheer Nederland publiceerde de Stand van de Uitvoering over de eerste helft van 2026. Op 30 juni stonden bij de regionale netbeheerders 15.498 aanvragen voor afname in de wachtrij (9.986 MW), tegen 15.154 eind 2025. Voor invoeding daalde het aantal naar 8.558. Er was ongeveer 4,4 GW flexibel vermogen gecontracteerd. Kleinverbruikers zitten nog niet in deze cijfers.",
  "thema": "net",
  "bron": "Netbeheer Nederland",
  "bronUrl": "https://www.netbeheernederland.nl/artikelen/nieuws/slimmer-netgebruik-wint-terrein-maar-vraag-naar-transportcapaciteit-groeit-nog",
  "gepubliceerd": "2026-10-05",
  "toegevoegd": "2026-10-22T23:05:00+02:00",
  "datasets": [
    "capaciteitskaart-elektriciteitsnet"
  ],
  "zekerheid": "hoog"
}
