{
  "slug": "2026-10-13-gemiddelde-energietarieven-september",
  "titel": "Gemiddelde energietarieven voor consumenten bijgewerkt tot en met september",
  "samenvatting": "CBS werkte op 13 oktober de tabel Gemiddelde energietarieven voor consumenten bij. De maandreeks begint in januari 2021 en loopt nu tot en met september 2026; de laatste maand is voorlopig. Sinds verslagmaand januari 2026 staan er ook gemiddelde prijzen voor dynamische contracten in. Nieuwe cijfers verschijnen doorgaans tussen de eerste en tweede donderdag van de maand.",
  "thema": "markt",
  "bron": "CBS StatLine",
  "bronUrl": "https://www.cbs.nl/nl-nl/cijfers/detail/85592NED",
  "gepubliceerd": "2026-10-13",
  "toegevoegd": "2026-10-22T23:05:00+02:00",
  "zekerheid": "hoog"
}
