{
  "slug": "2026-10-29-acm-uht-gegevensuitwisseling-nettarieven",
  "titel": "ACM acht de regels voor gegevensuitwisseling bij tijdsafhankelijke nettarieven uitvoerbaar",
  "samenvatting": "De ACM publiceerde haar uitvoerbaarheids- en handhaafbaarheidstoets op conceptartikelen van de Energieregeling en de Regeling gegevensuitwisseling Energiewet. Die regelen welke gegevens netbeheerders en leveranciers uitwisselen over tijdsafhankelijke transporttarieven en wat op de jaarrekening staat. De ACM vraagt de minister te onderzoeken of leveranciers gedetailleerdere gegevens over het netgebruik van kleine aansluitingen mogen krijgen.",
  "thema": "net",
  "bron": "Autoriteit Consument & Markt",
  "bronUrl": "https://www.acm.nl/nl/publicaties/uht-op-conceptregelingen-voor-tijdsafhankelijke-nettarieven",
  "gepubliceerd": "2026-10-29",
  "toegevoegd": "2026-10-30T07:25:35+01:00",
  "zekerheid": "midden"
}
