{
  "slug": "2026-10-07-tariefvoorstellen-netbeheerders-2027",
  "titel": "ACM publiceert de tariefvoorstellen van de netbeheerders voor 2027",
  "samenvatting": "De ACM zette op 7 oktober de tariefvoorstellen voor 2027 online, per netbeheerder en apart voor elektriciteit en gas: Liander, Stedin, Enexis, Coteq, RENDO en Westland. Van TenneT staan er voorstellen voor landelijk systeembeheer en voor net op zee. Een besluit volgt in november. De ACM schatte eerder een stijging van gemiddeld 20 procent voor transport.",
  "thema": "markt",
  "bron": "Autoriteit Consument & Markt",
  "bronUrl": "https://www.acm.nl/nl/publicaties/acm-publiceert-tariefvoorstellen-netbeheerders-2027",
  "gepubliceerd": "2026-10-07",
  "toegevoegd": "2026-10-22T23:05:00+02:00",
  "zekerheid": "hoog"
}
