{
  "slug": "2026-10-19-nieuwe-indicator-aardwarmte-landbouw",
  "titel": "Nieuwe indicator in de Klimaatmonitor: verbruik van aardwarmte in de landbouw",
  "samenvatting": "De Regionale Klimaatmonitor voegde op 19 oktober een nieuwe indicator toe: het verbruik van aardwarmte in de landbouw. De databank bundelt cijfers over CO2-uitstoot, energiegebruik en hernieuwbare opwek per gemeente, regio en provincie. Over welke jaren de nieuwe indicator loopt en uit welke bron hij komt, staat niet in het wijzigingsbericht.",
  "thema": "opwek",
  "bron": "Regionale Klimaatmonitor",
  "bronUrl": "https://klimaatmonitor.databank.nl/nieuws/aardwarmte-landbouw/333",
  "gepubliceerd": "2026-10-19",
  "toegevoegd": "2026-10-22T23:05:00+02:00",
  "zekerheid": "midden"
}
