{
  "slug": "2026-10-21-acm-dashboard-netbenutting",
  "titel": "ACM publiceert eerste monitoringsdashboard over benutting van het elektriciteitsnet",
  "samenvatting": "De ACM bracht de eerste kwartaalrapportage uit van haar openbare dashboard over de verbeterplannen van de netbeheerders, met cijfers over het tweede kwartaal van 2026. Per netbeheerder is te zien welke maatregelen voor netinzicht en congestiemanagement zijn ingevoerd. De regionale netbeheerders gaven in 2025 1,6 miljoen euro uit aan congestiemanagement, TenneT 49 miljoen. Volgende update begin 2027.",
  "thema": "net",
  "bron": "Autoriteit Consument & Markt",
  "bronUrl": "https://www.acm.nl/nl/publicaties/acm-netbeheerders-rapporteren-dat-zij-op-koers-liggen-met-verbeterprogramma-netcongestie",
  "gepubliceerd": "2026-10-21",
  "toegevoegd": "2026-10-22T22:45:00+02:00",
  "zekerheid": "hoog"
}
