{
  "slug": "2026-10-07-klimaatmonitor-inzet-groen-gas",
  "titel": "Klimaatmonitor actualiseert de aandelen groen gas die als aardgas worden ingezet",
  "samenvatting": "De Regionale Klimaatmonitor werkte op 7 oktober de aandelen groen gas bij die als aardgas worden ingezet, over 2024 en 2025. Dezelfde dag zijn de kort daarvoor toegevoegde gegevens over hernieuwbare energie uit rioolwaterzuiveringsinstallaties omgerekend naar directe en indirecte energie uit groen gas. Wat de nieuwe aandelen zijn, staat niet in het wijzigingsbericht.",
  "thema": "opwek",
  "bron": "Regionale Klimaatmonitor",
  "bronUrl": "https://klimaatmonitor.databank.nl/nieuws/inzet-groen-gas-als-aardgas/329",
  "gepubliceerd": "2026-10-07",
  "toegevoegd": "2026-10-22T23:05:00+02:00",
  "zekerheid": "midden"
}
