{
  "slug": "2026-10-29-liander-capaciteitsupdate-oktober",
  "titel": "Liander meldt veertien nieuwe knelpunten in de capaciteitsupdate van oktober",
  "samenvatting": "Liander publiceerde zijn maandelijkse overzicht van de transportcapaciteit voor grootverbruikaansluitingen boven 3 x 80 ampère. De update noemt veertien nieuwe knelpunten in Flevoland, Friesland, Gelderland en Noord-Holland, één afgerond congestieonderzoek bij station Tiel met potentieel vermogen voor teruglevering, en drie stations in Friesland waar weer beperkt capaciteit beschikbaar is.",
  "thema": "net",
  "bron": "Liander",
  "bronUrl": "https://www.liander.nl/over-ons/nieuws/2026/update-capaciteit-elektricitetissnet-oktober-2026",
  "gepubliceerd": "2026-10-29",
  "toegevoegd": "2026-10-30T07:25:35+01:00",
  "datasets": ["capaciteitskaart-elektriciteitsnet"],
  "zekerheid": "hoog"
}
